{
  "id": "browser_click",
  "name": "Click selector",
  "category": "browser",
  "description": "Deprecated alias of browser_click_element. Click an element in the active browser tab using a CSS selector.",
  "inputs": {
    "session_id": {"type": "string", "required": false, "description": "Optional browser session identifier. Uses active session when omitted."},
    "selector": {"type": "string", "required": true, "description": "CSS selector to click."},
    "timeout_ms": {"type": "integer", "required": false, "description": "Optional timeout override in milliseconds."}
  },
  "outputs": {
    "status": {"type": "string", "enum": ["success", "error"]},
    "selector": {"type": "string"},
    "url": {"type": "string"},
    "session_id": {"type": "string"}
  },
  "constraints": {
    "timeout_ms": 10000,
    "allowlist": [],
    "workspace_only": false
  },
  "safety": {
    "level": "medium",
    "requires_confirmation": false
  },
  "lifecycle": {
    "version": "1.2.0",
    "status": "ready"
  }
}
