{
  "id": "browser_close_session",
  "name": "Close browser session",
  "category": "browser",
  "description": "Close a controlled browser session. Uses active session when session_id is omitted.",
  "inputs": {
    "session_id": {"type": "string", "required": false, "description": "Optional browser session identifier. Uses active session when omitted."}
  },
  "outputs": {
    "status": {"type": "string", "enum": ["success", "error"]},
    "session_id": {"type": "string"}
  },
  "constraints": {
    "timeout_ms": 10000,
    "allowlist": [],
    "workspace_only": true
  },
  "safety": {
    "level": "medium",
    "requires_confirmation": false
  },
  "lifecycle": {
    "version": "1.2.0",
    "status": "ready"
  }
}
